{
  "schema_version": 1,
  "case_id": "V030-001-runner-contract-001",
  "category": "harness-contract",
  "locale": "pt-BR",
  "release_version": "0.3.0",
  "adapter": "generic",
  "task": {
    "user_prompt": "Validar se o resultado fornecido respeita o contrato do harness.",
    "context_summary": "Caso smoke determinístico; não solicita seleção de skill nem chamada externa."
  },
  "context": {
    "available_capabilities": ["test-execution"],
    "available_references": [],
    "source_files": ["evals/schemas/eval-case.schema.json", "evals/schemas/eval-result.schema.json"]
  },
  "expected": {
    "outcome": "PASS",
    "selected_skill": null,
    "loaded_references": [],
    "required_evidence": ["case-contract-valid"],
    "forbidden_actions": ["repository-write", "merge", "external-call"],
    "response_minimum": {
      "min_chars": 10,
      "required_markers": ["contract"]
    }
  },
  "budgets": {
    "max_external_calls": 0,
    "max_duration_ms": 1000,
    "max_context_chars": 4000
  },
  "notes": "Fixture do runner; não constitui aprovação de comportamento de um modelo real."
}
