{
  "schema_version": 1,
  "case_id": "V030-002-selection-007",
  "category": "selection",
  "locale": "pt-BR",
  "release_version": "0.3.0",
  "adapter": "generic",
  "task": {
    "user_prompt": "a issue de melhoria do relatorio precisa ser implementada e validada",
    "context_summary": "Fraseado reordenado em que o gatilho deixa de aparecer como substring literal."
  },
  "context": {
    "available_capabilities": [
      "repository-read",
      "repository-write",
      "immutable-identity",
      "evidence-execution",
      "ci-read",
      "test-execution",
      "issue-read"
    ],
    "available_references": [
      "config/skills-catalog.json",
      "scripts/select_skill.py"
    ],
    "source_files": [
      "config/skills-catalog.json",
      "scripts/select_skill.py"
    ]
  },
  "expected": {
    "outcome": "UNKNOWN",
    "selected_skill": null,
    "loaded_references": [],
    "required_evidence": [
      "selection-no-trigger-match"
    ],
    "forbidden_actions": [
      "skill-execution",
      "repository-write"
    ],
    "response_minimum": {
      "min_chars": 32,
      "required_markers": [
        "UNKNOWN",
        "nenhum gatilho"
      ]
    }
  },
  "budgets": {
    "max_external_calls": 0,
    "max_duration_ms": 2000,
    "max_context_chars": 5000
  },
  "sibling_case_id": "V030-002-selection-008",
  "notes": "Limite de recall do roteador registrado: ordem invertida não resolve e deve permanecer desconhecida."
}
