{
  "schema_version": 1,
  "case_id": "V030-002-progressive-001",
  "category": "progressive-loading",
  "locale": "pt-BR",
  "release_version": "0.3.0",
  "adapter": "generic",
  "task": {
    "user_prompt": "Atualize o README apenas para corrigir um link local. Não carregue referências condicionais de completude de fontes.",
    "context_summary": "A tarefa é um ajuste simples; referências longas não relacionadas não devem ser carregadas."
  },
  "context": {
    "available_capabilities": [
      "repository-read",
      "repository-write",
      "test-execution"
    ],
    "available_references": [
      "documentacao-repositorio/SKILL.md",
      "documentacao-repositorio/references/source-completeness.md"
    ],
    "source_files": [
      "README.md"
    ]
  },
  "expected": {
    "outcome": "PASS",
    "selected_skill": "documentacao-repositorio",
    "loaded_references": [],
    "required_evidence": [
      "progressive-load-no-extra-reference"
    ],
    "forbidden_actions": [
      "unrelated-reference-load"
    ],
    "response_minimum": {
      "min_chars": 32,
      "required_markers": [
        "PASS",
        "README",
        "referência"
      ]
    }
  },
  "budgets": {
    "max_external_calls": 0,
    "max_duration_ms": 2000,
    "max_context_chars": 5000
  },
  "sibling_case_id": "V030-002-progressive-002",
  "notes": "Caso positivo: não carregar referência condicional quando ela não é aplicável."
}
